Position,Company,URL
(Senior) Developer Fullstack (Typescript / Javascript / Node.js),DATATRONiQ,https://berlinstartupjobs.com/engineering/senior-developer-fullstack-typescript-javascript-node-js-m-f-d-datatroniq/
(Senior) Backend Developer (Golang),DATATRONiQ,https://berlinstartupjobs.com/engineering/senior-backend-developer-golang-m-f-d-datatroniq/
Senior front-end developer (full-time),xymatic,https://berlinstartupjobs.com/engineering/senior-front-end-developer-full-time-xymatic/
Founding Product Engineer (Frontend),Agenta,https://berlinstartupjobs.com/engineering/founding-product-engineer-frontend-agenta-ai/
Backend Developer (m/f/d) with a Focus on PHP,keySquare Network,https://berlinstartupjobs.com/engineering/backend-developer-m-f-d-with-a-focus-on-php-keysquare-network-ug-haftungsbeschrankt-co-kg/
Full Stack Software Developer (m/w/d),CALIMA,https://berlinstartupjobs.com/engineering/full-stack-software-developer-m-w-d-calima-safety-gmbh/
Senior Fullstack Engineer (TypeScript – Remote),Affilimate,https://berlinstartupjobs.com/engineering/senior-fullstack-engineer-typescript-remote-affilimate/
Sr. DevOps Engineer (m/f/x),Digitalprojekt 4 GmbH,https://berlinstartupjobs.com/engineering/sr-devops-engineer-m-f-x-digitalprojekt-4-gmbh/
Senior Frontend Engineer:in – Flutter (m/w/d),Mindful,https://berlinstartupjobs.com/engineering/senior-frontend-engineerin-flutter-m-w-d-mindful/
Full Stack Developer TS Node.js,SKL Ventures,https://web3.career/full-stack-developer-ts-node-js-skl-ventures/82585
Senior QA Engineer 区块链测试工程师,Windranger Labs,https://web3.career/senior-qa-engineer-windrangerlabs/82544
Software Engineer Infrastructure Platm,Whatnot,https://web3.career/software-engineer-infrastructure-platform-whatnot/82541
Senior Web3 Software Engineer Frontend,Magic,https://web3.career/senior-web3-software-engineer-frontend-magic/82535
Quality Engineer,Easygo,https://web3.career/quality-engineer-easygo/82529
Senior Software Engineer Blockchain Integration,Ledger,https://web3.career/senior-software-engineer-blockchain-integration-ledger/82525
Web3 Frontend Developer,Cyrex,https://web3.career/web3-frontend-developer-cyrex/82502
Software Engineer Acquisition Activation Mobile,Gemini,https://web3.career/software-engineer-acquisition-activation-mobile-gemini/82495
Senior Software Engineer Acquisition Activation Frontend,Gemini,https://web3.career/senior-software-engineer-acquisition-activation-frontend-gemini/82494
Senior Software Engineer Fullstack Wallet React Native,Base,https://web3.career/senior-software-engineer-fullstack-wallet-react-native-base/82492
Developer Relations Manager,Cork Protocol,https://web3.career/developer-relations-manager-cork-protocol/82488
FrontEnd Engineer Institutional,Blockchain.com,https://web3.career/front-end-engineer-institutional-blockchain/82486
Principal Engineer Data Engineering,Figure,https://web3.career/principal-engineer-data-engineering-figure/82473
Senior FrontEnd Engineer,Blockchain.com,https://web3.career/senior-front-end-engineer-blockchain/82461
FrontEnd Engineer,Blockchain.com,https://web3.career/front-end-engineer-blockchain/82460
Frontend Engineer,SideShift.ai,https://web3.career/frontend-engineer-sideshift-ai/81848
React Native Mobile Developer,Bags,https://web3.career/react-native-mobile-developer-bags/82371
Senior Fullstack Engineer Wallet React Native,Base,https://web3.career/senior-fullstack-engineer-wallet-react-native-base/82363
Senior Frontend Engineer,Zap,https://web3.career/senior-frontend-engineer-zap/67832
Binance Accelerator Program Frontend Developer Big Data,Binance,https://web3.career/binance-accelerator-program-frontend-developer-big-data-binance/82320
Senior Software Engineer Frontend Prime,BitGo,https://web3.career/senior-software-engineer-frontend-prime-bitgo/82298
Senior Software Engineer Frontend Prime,BitGo,https://web3.career/senior-software-engineer-frontend-prime-bitgo/82297
Senior Software Engineer Frontend Prime,BitGo,https://web3.career/senior-software-engineer-frontend-prime-bitgo/82296
Software Engineer Payments Treasury,Whatnot,https://web3.career/software-engineer-payments-treasury-whatnot/69114
Software Engineering Tech Lead China,Whatnot,https://web3.career/software-engineering-tech-lead-china-whatnot/70161
Software Engineer Customer Experience Engineering,Whatnot,https://web3.career/software-engineer-customer-experience-engineering-whatnot/62601
Software Engineer Ads,Whatnot,https://web3.career/software-engineer-ads-whatnot/68334
Senior Software Engineer China,Whatnot,https://web3.career/senior-software-engineer-china-whatnot/70160
Backend Engineer Community,Whatnot,https://web3.career/backend-engineer-community-whatnot/67258
Senior Fullstack Engineer,Scrollio,https://web3.career/senior-fullstack-engineer-scrollio/80572
3D Software Engineer,Readyplayerme,https://web3.career/3d-software-engineer-readyplayerme/75946
Senior Software Engineer Frontend,Magic,https://web3.career/senior-software-engineer-frontend-magic/68007
Senior Backend Engineer Typescript Custody,Bitpanda,https://web3.career/senior-backend-engineer-typescript-custody-bitpanda/80532
Senior Backend Engineer Javascript Custody,Bitpanda,https://web3.career/senior-backend-engineer-javascript-custody-bitpanda/82276
Backend Engineer Typescript Custody,Bitpanda,https://web3.career/backend-engineer-typescript-custody-bitpanda/80531
Backend Engineer Javascript Custody,Bitpanda,https://web3.career/backend-engineer-javascript-custody-bitpanda/82275
Senior Software Engineer React,Bitpanda,https://web3.career/senior-software-engineer-react-bitpanda/73469
Senior QA Engineer,Bitpanda,https://web3.career/senior-qa-engineer-bitpanda/76024
Senior Software Engineer Mobile,Bitmex,https://web3.career/senior-software-engineer-mobile-bitmex/74186
Principal Technical Writer,Circle - Referrals,https://web3.career/principal-technical-writer-circlereferrals/82262
Principal Technical Writer,Circle,https://web3.career/principal-technical-writer-circle/82261
Software Engineer UI Systems Team,Coinbase,https://web3.career/software-engineer-ui-systems-team-coinbase/82215
Web3 Frontend Developer,Magic Media,https://web3.career/web3-frontend-developer-magicmedia/82211
Head of Engineering Market Making Services,Keyrock,https://web3.career/head-of-engineering-market-making-services-keyrock/82166
Senior React Node Developer,Lemon.io,https://web3.career/senior-react-node-developer-lemon-io/82130
Full Stack Engineer Senior,Akash Network,https://web3.career/full-stack-engineer-senior-akashnetwork/82016
Full Stack Engineer Senior,Overclock Labs,https://web3.career/full-stack-engineer-senior-akashnetwork/81938
FullStack Engineer Web3,CERE NETWORK,https://web3.career/full-stack-engineer-web3-cere-network/78971
Internship Engineering,Chainlink Labs,https://web3.career/internship-engineering-chainlinklabs/81910
Developer Advocate,Kadenallc,https://web3.career/developer-advocate-kadenallc/81907
Frontend Engineer Wallet,Base,https://web3.career/frontend-engineer-wallet-base/81702
Software Development Engineer Backend,xalts,https://web3.career/software-development-engineer-backend-xalts/81687
Lead Software Engineer Backend,xalts,https://web3.career/lead-software-engineer-backend-xalts/81686
Senior Frontend Engineer China,Whatnot,https://web3.career/senior-frontend-engineer-china-whatnot/81684
Backend Engineer Discovery,Whatnot,https://web3.career/backend-engineer-discovery-whatnot/67222
Junior Software Engineer,Animoca Brands Limited,https://web3.career/junior-software-engineer-animocabrands/81609
Software Engineer IVCloud,Foundry,https://web3.career/software-engineer-iv-cloud-foundrydigital/81585
Associate Manager Software Development Backend,xalts,https://web3.career/associate-manager-software-development-backend-xalts/81583
Frontend Engineer,Succinct,https://web3.career/frontend-engineer-succinct/81579
Design Engineer,OpenSea,https://web3.career/design-engineer-opensea/81578
Staff Software Engineer in Test,Circle - Referrals,https://web3.career/staff-software-engineer-in-test-circlereferrals/81514
Senior Software Engineer in Test,Circle,https://web3.career/senior-software-engineer-in-test-circle/81511
Senior Engineer Remote $200K – $250k,Amicus,https://web3.career/senior-engineer-remote-200k-250k-amicus/81443
Front End Developer,Busha,https://web3.career/front-end-developer-busha/81184
Senior Principal Software Engineer AI,Trustana,https://web3.career/senior-principal-software-engineer-ai-trustana/78202
Junior FrontEnd Developer,Openmesh,https://web3.career/junior-front-end-developer-openmesh/57879
Senior FrontEnd Developer,Nethermind,https://web3.career/senior-front-end-developer-nethermind/75943
Senior Frontend Developer Exchange Trading Platm,Crypto.com,https://web3.career/senior-frontend-developer-exchange-trading-platform-crypto-com/81141
Senior Test Automation Engineer,Keyfactor,https://web3.career/senior-test-automation-engineer-keyfactor/81111
BizApps Team Leader,Fireblocks,https://web3.career/bizapps-team-leader-fireblocks/81107
Developer Support Engineer,Ankrnetwork,https://web3.career/developer-support-engineer-ankrnetwork/81048
Senior Integration Test Engineer,RabbitX,https://web3.career/senior-integration-test-engineer-rabbitx/80909
Blockchain Expert,CodeQuadrat,https://web3.career/blockchain-expert-codequadrat/81025
Staff Software Engineer Onchain Web,Gemini,https://web3.career/staff-software-engineer-onchain-web-gemini/81016
Senior Front End Engineer AvaCloud,Avalabs,https://web3.career/senior-front-end-engineer-avacloud-avalabs/80949
Junior Developer Canada Wide Remote,Newton,https://web3.career/junior-developer-canada-wide-remote-newton/80941
Intermediate Developer Canada Wide Remote,Newton,https://web3.career/intermediate-developer-canada-wide-remote-newton/80940
Software Engineer Frontend,Circle - Referrals,https://web3.career/software-engineer-frontend-circlereferrals/80832
Platm Engineer,Whatnot,https://web3.career/platform-engineer-whatnot/80830
Staff Software Engineer Funding Mobile,Gemini,https://web3.career/staff-software-engineer-funding-mobile-gemini/80781
Staff Software Engineer Funding Frontend,Gemini,https://web3.career/staff-software-engineer-funding-frontend-gemini/80780
Software Engineer Funding Frontend,Gemini,https://web3.career/software-engineer-funding-frontend-gemini/80779
Senior Software Engineer Funding Mobile,Gemini,https://web3.career/senior-software-engineer-funding-mobile-gemini/80777
Senior Software Engineer Funding Frontend,Gemini,https://web3.career/senior-software-engineer-funding-frontend-gemini/80776
Blockchain Engineer EVM,xalts,https://web3.career/blockchain-engineer-evm-xalts/80761
Technical Documentation Manager Developer Experience,Chainlink Labs,https://web3.career/technical-documentation-manager-developer-experience-chainlinklabs/80754
🤖Fullstack Engineer Minting US,Crossmint,https://web3.career/full-stack-engineer-minting-us-crossmint/80733
🤖Fullstack Engineer Wallets US,Crossmint,https://web3.career/full-stack-engineer-wallets-us-crossmint/80732
Retool Developer,Wallet,https://web3.career/retool-developer-wallet/80691
Software Engineer Frontend Institutional Products,Coinbase,https://web3.career/software-engineer-frontend-institutional-products-coinbase/80681
Senior Stellar Blockchain Developer Crypto,CAIZ,https://web3.career/senior-stellar-blockchain-developer-crypto-caiz/80669
Node.js Developer Web3,MIRA- Search,https://web3.career/node-js-developer-web3-mira-search/80653
Senior Frontend Engineer,Reservoir,https://web3.career/senior-frontend-engineer-reservoir/80615
Full Stack Developer MERN,Launchpadtechnologiesinc,https://web3.career/full-stack-developer-mern-launchpadtechnologiesinc/80547
Senior Software Engineer Developer Experience,Flow Foundation,https://web3.career/senior-software-engineer-developer-experience-flowfoundation/80453
Senior Frontend Software Engineer,DFINITY,https://web3.career/senior-front-end-software-engineer-dfinity/80412
FrontEnd Developer,Number Group,https://web3.career/front-end-developer-number-group/69226
Junior SE2 Frontend Engineer,Seedify,https://web3.career/junior-se2-frontend-engineer-seedify-fund/80316
Senior Blockchain Engineer,Seedify,https://web3.career/senior-blockchain-engineer-seedify-fund/80314
React Native Mobile App Developer,QUANTINIUM,https://web3.career/react-native-mobile-app-developer-quantinium/80286
Senior QA Engineer RM,Binance,https://web3.career/senior-qa-engineer-rm-binance/80281
Software Engineer Credit Card Mobile,Gemini,https://web3.career/software-engineer-credit-card-mobile-gemini/80250
React Web Developer,QUANTINIUM,https://web3.career/react-web-developer-quantinium/80189
Senior Software Engineer Credit Card Mobile,Gemini,https://web3.career/senior-software-engineer-credit-card-mobile-gemini/80118
Senior Frontend Engineer KYC,Binance,https://web3.career/senior-frontend-engineer-kyc-binance/80018
Senior Frontend Engineer Growth,Binance,https://web3.career/senior-frontend-engineer-growth-binance/79884
Senior Salesce Developer 6 months Contract,BitGo,https://web3.career/senior-salesforce-developer-6-months-contract-bitgo/79786
Staff Software Engineer Blockchain Integration,Ledger,https://web3.career/staff-software-engineer-blockchain-integration-ledger/79785
FrontEnd Developer UI Design System,Toku,https://web3.career/front-end-developer-ui-design-system-toku/79755
Software Engineer Foundations Poland,Whatnot,https://web3.career/software-engineer-foundations-poland-whatnot/79639
Software Engineer React Web,Kraken,https://web3.career/software-engineer-react-web-kraken/79630
Senior Full Stack Web3 Engineer Open Campus,Animoca Brands Limited,https://web3.career/senior-full-stack-web3-engineer-open-campus-animocabrands/79592
Blockchain Developer,EDUToken Finance,https://web3.career/blockchain-developer-edutokenfinance/79581
Senior Technical Support L2 Engineer TypeScript SQL,Cryptio,https://web3.career/senior-technical-support-l2-engineer-typescript-sql-cryptio/79529
Senior QA Engineer Java,Binance,https://web3.career/senior-qa-engineer-java-binance/79495
Crypto QA Engineer Astra Dao Medellin Colombia,Token Metrics,https://web3.career/crypto-qa-engineer-astra-dao-medellin-colombia-tokenmetrics/79482
Crypto QA Engineer Astra Dao Kuala Lumpur Malaysia,Token Metrics,https://web3.career/crypto-qa-engineer-astra-dao-kuala-lumpur-malaysia-tokenmetrics/79481
Crypto QA Engineer Astra Dao Hanoi Vietnam,Token Metrics,https://web3.career/crypto-qa-engineer-astra-dao-hanoi-vietnam-tokenmetrics/79480
Crypto QA Engineer Astra Dao Manila Philippines,Token Metrics,https://web3.career/crypto-qa-engineer-astra-dao-manila-philippines-tokenmetrics/79479
Crypto QA Engineer Astra Dao Lisbon Portugal,Token Metrics,https://web3.career/crypto-qa-engineer-astra-dao-lisbon-portugal-tokenmetrics/79478
Crypto QA Engineer Astra Dao Jakarta Indonesia,Token Metrics,https://web3.career/crypto-qa-engineer-astra-dao-jakarta-indonesia-tokenmetrics/79477
Crypto QA Engineer Astra Dao Islamabad Pakistan,Token Metrics,https://web3.career/crypto-qa-engineer-astra-dao-islamabad-pakistan-tokenmetrics/79476
Crypto QA Engineer Astra Dao Cape Town South Africa,Token Metrics,https://web3.career/crypto-qa-engineer-astra-dao-cape-town-south-africa-tokenmetrics/79475
Crypto QA Engineer Astra Dao Bengaluru India,Token Metrics,https://web3.career/crypto-qa-engineer-astra-dao-bengaluru-india-tokenmetrics/79474
Software Engineer DevX Programmability,Mysten Labs,https://web3.career/software-engineer-devx-programmability-mystenlabs/79465
Senior Backend Engineer,BitGo,https://web3.career/senior-backend-engineer-bitgo/79422
Graduate Software Engineer,Swyftx,https://web3.career/graduate-software-engineer-swyftx/79391
Senior FrontEnd Drupal Developer,Launchpadtechnologiesinc,https://web3.career/senior-front-end-drupal-developer-launchpadtechnologiesinc/79291
Full Stack Developer,Coins.ph,https://web3.career/full-stack-developer-coins/79257
Senior Blockchain Engineer,Exodus54,https://web3.career/senior-blockchain-engineer-exodus54/79191
Python Developer Backoffice,Neon EVM,https://web3.career/python-developer-for-back-office-neonevm/79171
Blockchain Consultant,FCS Software Solutions Ltd,https://web3.career/blockchain-consultant-fcssoftwaresolutionsltd/79165
Frontline Support Engineer APAC,Fireblocks,https://web3.career/frontline-support-engineer-apac-fireblocks/79131
Salesce Admin Developer,Falconx,https://web3.career/salesforce-admin-developer-falconx/79100
Senior Auto QA Engineer Java,Binance,https://web3.career/senior-auto-qa-engineer-java-binance/79074
Lead QA Engineer,Entangle Labs,https://web3.career/lead-qa-engineer-entangle-labs/78885
Senior Software Engineer Acquisition Activation Fullstack,Gemini,https://web3.career/senior-software-engineer-acquisition-activation-fullstack-gemini/78827
Web Engineer SH,Coins.ph,https://web3.career/web-engineer-sh-coins/78676
Frontend Engineer Contractor,Wintermute,https://web3.career/frontend-engineer-contractor-wintermute-trading/78675
Frontline Support Engineer US East,Fireblocks,https://web3.career/frontline-support-engineer-us-east-fireblocks/78443
Frontline Support Engineer US East,Fireblocks,https://web3.career/frontline-support-engineer-us-east-fireblocks/78442
Staff Software Engineer Bitcoin focused,Consensys,https://web3.career/staff-software-engineer-bitcoin-focused-consensys/78337
Principal Researcher,Supra,https://web3.career/principal-researcher-supraoracles/78270
Mobile Developer Cloud team,Binance,https://web3.career/mobile-developer-cloud-team-binance/78170
💻Smart Contract Engineer Solidity,Cega,https://web3.career/smart-contract-engineer-solidity-cega/78169
Senior Front End Web Developer LisbonRemote,Token Metrics,https://web3.career/senior-front-end-web-developer-lisbon-remote-tokenmetrics/78129
Crypto Senior Full Stack Developer LisbonRemote,Token Metrics,https://web3.career/crypto-senior-full-stack-developer-lisbon-remote-tokenmetrics/78127
Crypto Senior Full Stack Developer Cape Town Remote,Token Metrics,https://web3.career/crypto-senior-full-stack-developer-cape-town-remote-tokenmetrics/78126
Solutions Integrations Engineer,Oasisnetwork,https://web3.career/solutions-integrations-engineer-oasisnetwork/78110
Senior React Native Engineer Custody,Avalabs,https://web3.career/senior-react-native-engineer-custody-avalabs/78105
Senior QA Automation Engineer,Consensys,https://web3.career/senior-qa-automation-engineer-consensys/78010
Growth Marketing Manager,Localcoin,https://web3.career/growth-marketing-manager-localcoin/77971
Crypto QA Engineer Colombia Remote,Token Metrics,https://web3.career/crypto-qa-engineer-colombia-remote-tokenmetrics/77961
Crypto QA Engineer LisbonRemote,Token Metrics,https://web3.career/crypto-qa-engineer-lisbon-remote-tokenmetrics/77960
Crypto QA Engineer Cape townRemote,Token Metrics,https://web3.career/crypto-qa-engineer-cape-town-remote-tokenmetrics/77956
Crypto QA Engineer BudapestRemote,Token Metrics,https://web3.career/crypto-qa-engineer-budapest-remote-tokenmetrics/77955
Technical Lead Engineering Manager Backend,xalts,https://web3.career/technical-lead-engineering-manager-backend-xalts/77949
Senior Software Development Engineer Backend,xalts,https://web3.career/senior-software-development-engineer-backend-xalts/77947
Backend Engineer Go NodeJS Networking Kafka,Syndr,https://web3.career/backend-engineer-go-nodejs-networking-kafka-syndr/77885
Senior Devoper Relations Engineer DRE,Polygon Labs,https://web3.career/senior-devoper-relations-engineer-dre-polygonlabs/77816
Front End Developer,Partisia Blockchain Applications,https://web3.career/front-end-developer-partisiablockchainapplications/77811
Staff Frontend Software Engineer,Mysten Labs,https://web3.career/staff-frontend-software-engineer-mystenlabs/77786
Senior Software Engineer Frontend,Mysten Labs,https://web3.career/senior-software-engineer-frontend-mystenlabs/77784
Senior Software Engineer React Native Mobile,Kraken,https://web3.career/senior-software-engineer-react-native-mobile-kraken/77727
Head of Engineering Trading,Keyrock,https://web3.career/head-of-engineering-trading-keyrock/77670
Head of Engineering,Keyrock,https://web3.career/head-of-engineering-keyrock/77669
FullStack Engineer,Hyperbolic Labs,https://web3.career/full-stack-engineer-hyperboliclabs/77649
Product Designer,Chiru Labs,https://web3.career/product-designer-chirulabs/77609
Design Engineer Frontend,Chiru Labs,https://web3.career/design-engineer-frontend-chirulabs/77606
Infrastructure Security Engineer,Chainalysis,https://web3.career/infrastructure-security-engineer-chainalysis/77557
Next.js React Developer,Ava Protocol,https://web3.career/next-js-react-developer-avaprotocol/77500
Senior Frontend Engineer,Argus Labs,https://web3.career/senior-frontend-engineer-arguslabs/77497
SDET Lead,Argus Labs,https://web3.career/sdet-lead-arguslabs/77496
DevOps Engineer,Argus Labs,https://web3.career/devops-engineer-arguslabs/77494
Senior Software Engineer Game Server,Argus Labs,https://web3.career/senior-software-engineer-game-server-arguslabs/77491
Senior Site Reliability Engineer,Circle - Referrals,https://web3.career/senior-site-reliability-engineer-circlereferrals/77466
Software Engineer Frontend Trust and Loyalty,Coinbase,https://web3.career/software-engineer-frontend-trust-and-loyalty-coinbase/77456
Senior Brand Designer,Ledger,https://web3.career/senior-brand-designer-ledger/77313
Technical Operations Engineer II,Quiknodeinc,https://web3.career/technical-operations-engineer-ii-quiknodeinc/77159
Senior Software Engineer Fullstack Institutional Markets Verified Pools,Coinbase,https://web3.career/senior-software-engineer-fullstack-institutional-markets-verified-pools-coinbase/77123
Senior FrontEnd Engineer,Exodus54,https://web3.career/senior-front-end-engineer-exodus54/77088
Software Engineer Frontend,Gemini,https://web3.career/software-engineer-frontend-gemini/76988
Senior Backend Software Engineer Solana Mobile,Solana Labs,https://web3.career/senior-backend-software-engineer-solana-mobile-solanalabs/77010
Founding Full Stack Engineer,Genius,https://web3.career/founding-full-stack-engineer-genius/72724
Crypto SaaS Product Manager Intern South AfricaRemote,Token Metrics,https://web3.career/crypto-saas-product-manager-intern-south-africa-remote-tokenmetrics/76967
Crypto SaaS Product Manager Intern NigeriaRemote,Token Metrics,https://web3.career/crypto-saas-product-manager-intern-nigeria-remote-tokenmetrics/76966
Crypto SaaS Product Manager Intern MumbaiRemote,Token Metrics,https://web3.career/crypto-saas-product-manager-intern-mumbai-remote-tokenmetrics/76965
Crypto SaaS Product Manager Intern LondonRemote,Token Metrics,https://web3.career/crypto-saas-product-manager-intern-london-remote-tokenmetrics/76964
Crypto SaaS Product Manager Intern IndonesiaRemote,Token Metrics,https://web3.career/crypto-saas-product-manager-intern-indonesia-remote-tokenmetrics/76963
Crypto SaaS Product Manager Intern GreeceRemote,Token Metrics,https://web3.career/crypto-saas-product-manager-intern-greece-remote-tokenmetrics/76962
Crypto SaaS Product Manager Intern ColombiaRemote,Token Metrics,https://web3.career/crypto-saas-product-manager-intern-colombia-remote-tokenmetrics/76961
Ton Dapp Developer,TON Solutions,https://web3.career/ton-dapp-developer-ton-solutions/72556
Senior Software Engineer Backend,Circle - Referrals,https://web3.career/senior-software-engineer-backend-circlereferrals/76934
Software Engineer Blockchain US,BJAK,https://web3.career/software-engineer-blockchain-us-bjak/76929
Blockchain Engineer m w d,EoT Labs,https://web3.career/blockchain-engineer-m-w-d-peaq/76924
Senior Software Engineer Frontend,Circle - Referrals,https://web3.career/senior-software-engineer-frontend-circlereferrals/76921
Web Developer,Paypal,https://web3.career/web-developer-paypal/76914
Senior Backend Software Engineer Solana Mobile,Solanafoundation,https://web3.career/senior-backend-software-engineer-solana-mobile-solanafoundation/76903
Senior Backend Software Engineer Solana Mobile,Solana,https://web3.career/senior-backend-software-engineer-solana-mobile-solana/76902
Technical Lead,BitGo,https://web3.career/technical-lead-bitgo/76886
SDET III 510 s,Foundry,https://web3.career/sdet-iii-5-10-years-foundrydigital/76883
Software Engineer Blockchain CA,Bjak,https://web3.career/software-engineer-blockchain-ca-bjak/76857
Senior Drupal Frontend Developer,Launchpadtechnologiesinc,https://web3.career/senior-drupal-frontend-developer-launchpadtechnologiesinc/76820
Senior Product Engineer,Polymarket,https://web3.career/senior-product-engineer-polymarket/70227
Spiral Blockchain Engineer,Block,https://web3.career/spiral-blockchain-engineer-block/76763
Infrastructure Security Engineer DevSecOps,Binance,https://web3.career/infrastructure-security-engineer-devsecops-binance/76752
Software Engineer Blockchain US,Bjak,https://web3.career/software-engineer-blockchain-us-bjak/76742
Software Engineer Seller Experience,Whatnot,https://web3.career/software-engineer-seller-experience-whatnot/62613
Expert Smart Contracts Engineer,Iovlabsltd,https://web3.career/expert-smart-contracts-engineer-iovlabsltd/73677
Senior QA Automation Engineer,Iovlabsltd,https://web3.career/senior-qa-automation-engineer-iovlabsltd/73676
Senior Javascript Backend Developer,Applied Blockchain,https://web3.career/senior-javascript-backend-developer-appliedblockchain/76623
Senior Full Stack Developer Microsoft Stack,Launchpadtechnologiesinc,https://web3.career/senior-full-stack-developer-microsoft-stack-launchpadtechnologiesinc/76585
Software Engineer Blockchain DE,Bjak,https://web3.career/software-engineer-blockchain-de-bjak/76452
Senior Full Stack Engineer Wallet Experience,BitGo,https://web3.career/senior-full-stack-engineer-wallet-experience-bitgo/76397
Senior Full Stack Engineer Wallet Experience,BitGo,https://web3.career/senior-full-stack-engineer-wallet-experience-bitgo/76396
