Position,Company,URL
Senior Web Engineer Crypto Trading,Robinhood,https://web3.career/senior-web-engineer-crypto-trading-robinhood/75661
Technical Product Manager,DIA,https://web3.career/technical-product-manager-dia/75444
Senior Blockchain Infrastructure Tooling Engineer,Proof of Play,https://web3.career/senior-blockchain-infrastructure-tooling-engineer-proofofplay/75436
Midlevel Fullstack Engineer,Klink Finance,https://web3.career/mid-level-fullstack-engineer-klinkfinance/75396
Lead Web Developer Marketing,Ripple,https://web3.career/lead-web-developer-marketing-ripple/75368
Senior Frontend Engineer Wallet Experience,BitGo,https://web3.career/senior-frontend-engineer-wallet-experience-bitgo/75349
Senior Frontend Engineer Wallet Experience,BitGo,https://web3.career/senior-frontend-engineer-wallet-experience-bitgo/75347
Senior Frontend Engineer Wallet Experience,BitGo,https://web3.career/senior-frontend-engineer-wallet-experience-bitgo/75346
Smart Contract Security Engineer,Eigenlabs,https://web3.career/smart-contract-security-engineer-eigenlabs/75197
Senior Frontend Engineer,Astria,https://web3.career/senior-frontend-engineer-astria/75194
Senior Frontend Engineer Content Tech,Binance,https://web3.career/senior-frontend-engineer-content-tech-binance/75190
Senior React Developer,LCX,https://web3.career/senior-react-developer-lcx/75165
Senior Web Engineer Crypto Trading I4 I5,Robinhood,https://web3.career/senior-web-engineer-crypto-trading-i4-i5-robinhood/75150
Senior Software Engineer Mobile React Native,BitGo,https://web3.career/senior-software-engineer-mobile-react-native-bitgo/75148
Senior Solana Developer Social App Game,Internet Game,https://web3.career/senior-solana-developer-for-social-app-game-internet-game/75114
Senior Front End Engineer,0xbow,https://web3.career/senior-front-end-engineer-0xbow/68422
CTO Digital Wealth Platm,Menyala,https://web3.career/cto-digital-wealth-platform-menyala/65763
Frontend engineer KYC,Wallet,https://web3.career/frontend-engineer-kyc-wallet/74771
Senior Typescript React Engineer,Figment,https://web3.career/senior-typescript-react-engineer-figment/74739
Software Engineer Frontend,Dydx,https://web3.career/software-engineer-frontend-dydx/74736
Software Development Engineer III UI,InMobi,https://web3.career/software-development-engineer-iii-ui-inmobi/74658
Lead Front End Engineer Marketing,Ripple,https://web3.career/lead-front-end-engineer-marketing-ripple/74646
Lead Front End Engineer Marketing,Ripple,https://web3.career/lead-front-end-engineer-marketing-ripple/74645
Developer Advocate,Celestia Labs,https://web3.career/developer-advocate-celestia/74620
Senior Full Stack Engineer Frontend Focused,Story Protocol,https://web3.career/senior-full-stack-engineer-frontend-focused-story-protocol/74614
Graduate Hire 2024 25 Software Engineer,Okx,https://web3.career/graduate-hire-2024-25-software-engineer-okx/74604
Senior Backend Engineer Payments,Fireblocks,https://web3.career/senior-backend-engineer-payments-fireblocks/74508
Internship Software Engineer Blockchain Engineer,Sonyglobal,https://web3.career/internship-software-engineer-blockchain-engineer-sonyglobal/74505
Fullstack Software Engineer React GCP Remote USA,U410,https://web3.career/fullstack-software-engineer-react-gcp-remote-usa-u410/74459
Senior React.js & PHP Developer,Lemon.io,https://weworkremotely.com/company/lemon-io
Senior React.js & Node.js Developer,Lemon.io,https://weworkremotely.com/company/lemon-io
Senior Full Stack Engineer (React Native),Co:Create,https://weworkremotely.com/company/co-create
