Position,Company,URL
Senior front-end developer (full-time),xymatic,https://berlinstartupjobs.com/engineering/senior-front-end-developer-full-time-xymatic/
Senior Software Developer,Visier,https://berlinstartupjobs.com/engineering/senior-software-developer-visier/
Founding Product Engineer (Frontend),Agenta,https://berlinstartupjobs.com/engineering/founding-product-engineer-frontend-agenta-ai/
Full Stack Software Developer (m/w/d),CALIMA,https://berlinstartupjobs.com/engineering/full-stack-software-developer-m-w-d-calima-safety-gmbh/
Software Engineer(s),EIDU,https://berlinstartupjobs.com/engineering/software-engineers-eidu-gmbh/
Senior Software Engineer Loan Originations,Figure,https://web3.career/senior-software-engineer-loan-originations-figure/79102
Senior Software Engineer Data Engineering,Figure,https://web3.career/senior-software-engineer-data-engineering-figure/79193
Senior Software Engineer CSP,Figure,https://web3.career/senior-software-engineer-csp-figure/81569
Senior Software Engineer Mobile,Bitcoindepot,https://web3.career/senior-software-engineer-mobile-bitcoindepot/82591
Full Stack Developer TS Node.js,SKL Ventures,https://web3.career/full-stack-developer-ts-node-js-skl-ventures/82585
Backend Engineer Web 3,Rampnetwork,https://web3.career/backend-engineer-web-3-rampnetwork/81471
Senior Web3 Software Engineer Frontend,Magic,https://web3.career/senior-web3-software-engineer-frontend-magic/82535
Senior Software Engineer Blockchain Integration,Ledger,https://web3.career/senior-software-engineer-blockchain-integration-ledger/82525
Software Engineer Acquisition Activation Mobile,Gemini,https://web3.career/software-engineer-acquisition-activation-mobile-gemini/82495
Senior Software Engineer Acquisition Activation Frontend,Gemini,https://web3.career/senior-software-engineer-acquisition-activation-frontend-gemini/82494
Senior Software Engineer Fullstack Wallet React Native,Base,https://web3.career/senior-software-engineer-fullstack-wallet-react-native-base/82492
FrontEnd Engineer Institutional,Blockchain.com,https://web3.career/front-end-engineer-institutional-blockchain/82486
Principal Engineer Data Engineering,Figure,https://web3.career/principal-engineer-data-engineering-figure/82473
Senior FrontEnd Engineer,Blockchain.com,https://web3.career/senior-front-end-engineer-blockchain/82461
FrontEnd Engineer,Blockchain.com,https://web3.career/front-end-engineer-blockchain/82460
Frontend Engineer,SideShift.ai,https://web3.career/frontend-engineer-sideshift-ai/81848
React Native Mobile Developer,Bags,https://web3.career/react-native-mobile-developer-bags/82371
Senior Fullstack Engineer Wallet React Native,Base,https://web3.career/senior-fullstack-engineer-wallet-react-native-base/82363
Senior Frontend Engineer: Zora,Zora,https://web3.career/senior-frontend-engineer-zora-zora/82353
Senior FullStack Engineer,Zap,https://web3.career/senior-full-stack-engineer-zap/74066
Senior Frontend Engineer,Zap,https://web3.career/senior-frontend-engineer-zap/67832
Senior Solidity Engineer,Magic,https://web3.career/senior-solidity-engineer-magic/82346
Senior Fullstack Engineer Typescript,Bitpanda,https://web3.career/senior-fullstack-engineer-typescript-bitpanda/82338
Fullstack Engineer Typescript,Bitpanda,https://web3.career/fullstack-engineer-typescript-bitpanda/82337
Senior Web3 Developer Python,Serotonin,https://web3.career/senior-web3-developer-python-serotonin/82324
Binance Accelerator Program Frontend Developer Big Data,Binance,https://web3.career/binance-accelerator-program-frontend-developer-big-data-binance/82320
Back End Developer,Bags,https://web3.career/back-end-developer-bags/82307
Senior Software Engineer Frontend Prime,BitGo,https://web3.career/senior-software-engineer-frontend-prime-bitgo/82298
Senior Software Engineer Frontend Prime,BitGo,https://web3.career/senior-software-engineer-frontend-prime-bitgo/82297
Senior Software Engineer Frontend Prime,BitGo,https://web3.career/senior-software-engineer-frontend-prime-bitgo/82296
Software Engineer Customer Experience Engineering,Whatnot,https://web3.career/software-engineer-customer-experience-engineering-whatnot/62601
Full Stack Engineer,Valorainc,https://web3.career/full-stack-engineer-valorainc/73970
Engineering Manager Developer Experience,Stellar,https://web3.career/engineering-manager-developer-experience-stellar/73916
Senior Frontend Engineer,Socket,https://web3.career/senior-frontend-engineer-socket/68856
Senior Fullstack Engineer,Scrollio,https://web3.career/senior-fullstack-engineer-scrollio/80572
3D Software Engineer,Readyplayerme,https://web3.career/3d-software-engineer-readyplayerme/75946
Senior Frontend Engineer,Rampnetwork,https://web3.career/senior-frontend-engineer-rampnetwork/77096
Senior Frontend Engineer,Rampnetwork,https://web3.career/senior-frontend-engineer-rampnetwork/77095
Senior Software Engineer Frontend,Magic,https://web3.career/senior-software-engineer-frontend-magic/68007
Senior Software Engineer React,Bitpanda,https://web3.career/senior-software-engineer-react-bitpanda/73469
Senior Software Engineer Mobile,Bitmex,https://web3.career/senior-software-engineer-mobile-bitmex/74186
Senior Software Engineer Blockchain Web3 USA,Shardeum Foundation,https://web3.career/senior-software-engineer-blockchain-web3-usa-shardeumfoundation/82265
FullStack Engineer,Loopscale,https://web3.career/full-stack-engineer-loopscale/82224
Software Engineer UI Systems Team,Coinbase,https://web3.career/software-engineer-ui-systems-team-coinbase/82215
Senior React Node Developer,Lemon.io,https://web3.career/senior-react-node-developer-lemon-io/82130
Full Stack Engineer Senior,Akash Network,https://web3.career/full-stack-engineer-senior-akashnetwork/82016
Public Relations Spring 2025 Internship,BerlinRosen,https://web3.career/public-relations-spring-2025-internship-berlinrosen/82009
Public Relations Spring 2025 Internship,Berlinrosen,https://web3.career/public-relations-spring-2025-internship-berlinrosen/81963
Full Stack Engineer Senior,Overclock Labs,https://web3.career/full-stack-engineer-senior-akashnetwork/81938
FullStack Engineer Web3,CERE NETWORK,https://web3.career/full-stack-engineer-web3-cere-network/78971
Tech Lead,Ante Labs,https://web3.career/tech-lead-ante-labs/81915
FullStack Engineer Backend Focus,Lavarage,https://web3.career/full-stack-engineer-backend-focus-lavarage/81857
Frontend Engineer Wallet,Base,https://web3.career/frontend-engineer-wallet-base/81702
FullStack Engineer,Bridgesplit,https://web3.career/full-stack-engineer-bridgesplit/81636
Junior Software Engineer,Animoca Brands Limited,https://web3.career/junior-software-engineer-animocabrands/81609
Backend Engineer Crypto Platm m f d,JUSTROCKET,https://web3.career/backend-engineer-for-crypto-platform-m-f-d-justrocket/81605
Software Engineering Manager Funding,Gemini,https://web3.career/software-engineering-manager-funding-gemini/81596
Frontend Engineer,Succinct,https://web3.career/frontend-engineer-succinct/81579
Design Engineer,OpenSea,https://web3.career/design-engineer-opensea/81578
Smart contract engineer DeFi,TruFin Labs,https://web3.career/smart-contract-engineer-defi-trufin-labs/74680
Staff Software Engineer Global Intelligence,Chainalysis,https://web3.career/staff-software-engineer-global-intelligence-chainalysis/81467
Software Engineer Global Intelligence PhD Graduate,Chainalysis,https://web3.career/software-engineer-global-intelligence-phd-graduate-chainalysis/81466
Senior Discretionary Researcher Special Situations,Hermeneutic Investments,https://web3.career/senior-discretionary-researcher-special-situations-hermeneutic-investments/62400
Gaming Spring 2025 Internship,BerlinRosen,https://web3.career/gaming-spring-2025-internship-berlinrosen/81437
Front End Developer,Busha,https://web3.career/front-end-developer-busha/81184
Junior FrontEnd Developer,Openmesh,https://web3.career/junior-front-end-developer-openmesh/57879
Senior FrontEnd Developer,Nethermind,https://web3.career/senior-front-end-developer-nethermind/75943
Senior Software Engineer,Figure,https://web3.career/senior-software-engineer-figure/58011
Full Stack Engineer Web3,DV Labs,https://web3.career/full-stack-engineer-web3-obol-tech/81164
Senior Frontend Developer Exchange Trading Platm,Crypto.com,https://web3.career/senior-frontend-developer-exchange-trading-platform-crypto-com/81141
Senior Test Automation Engineer,Keyfactor,https://web3.career/senior-test-automation-engineer-keyfactor/81111
Fullstack Software Engineer,Eigenlabs,https://web3.career/fullstack-software-engineer-eigenlabs/80951
Senior Front End Engineer AvaCloud,Avalabs,https://web3.career/senior-front-end-engineer-avacloud-avalabs/80949
Principal Software Engineer Platm,Gemini,https://web3.career/principal-software-engineer-platform-gemini/80855
Software Engineer Frontend,Circle - Referrals,https://web3.career/software-engineer-frontend-circlereferrals/80832
Staff Software Engineer Funding Mobile,Gemini,https://web3.career/staff-software-engineer-funding-mobile-gemini/80781
Staff Software Engineer Funding Frontend,Gemini,https://web3.career/staff-software-engineer-funding-frontend-gemini/80780
Software Engineer Funding Frontend,Gemini,https://web3.career/software-engineer-funding-frontend-gemini/80779
Senior Software Engineer Funding Mobile,Gemini,https://web3.career/senior-software-engineer-funding-mobile-gemini/80777
Senior Software Engineer Funding Frontend,Gemini,https://web3.career/senior-software-engineer-funding-frontend-gemini/80776
Fullstack developer,TON Tiger,https://web3.career/full-stack-developer-tontiger/80688
Software Engineer Frontend Institutional Products,Coinbase,https://web3.career/software-engineer-frontend-institutional-products-coinbase/80681
Senior Frontend Engineer 前端开发工程师,Windranger Labs,https://web3.career/senior-front-end-engineer-windrangerlabs/80620
Senior Frontend Engineer,Reservoir,https://web3.career/senior-frontend-engineer-reservoir/80615
Community Marketer,Nexus,https://web3.career/community-marketer-nexus/80597
Software Engineer Rust Backend Asset Listings,Kraken,https://web3.career/software-engineer-rust-backend-asset-listings-kraken/80582
Blockchain Engineer,Nethermind,https://web3.career/blockchain-engineer-nethermind/60155
Full Stack Developer MERN,Launchpadtechnologiesinc,https://web3.career/full-stack-developer-mern-launchpadtechnologiesinc/80547
Senior Software Engineer Developer Experience,Flow Foundation,https://web3.career/senior-software-engineer-developer-experience-flowfoundation/80453
Senior Software Engineer BGX,BitGo,https://web3.career/senior-software-engineer-bgx-bitgo/80451
Technology Backend Lead GLOBAL,QUANTINIUM,https://web3.career/technology-backend-lead-global-quantinium/80447
Senior Frontend Software Engineer,DFINITY,https://web3.career/senior-front-end-software-engineer-dfinity/80412
FrontEnd Developer,Number Group,https://web3.career/front-end-developer-number-group/69226
Engineering Manager,Swyftx,https://web3.career/engineering-manager-swyftx/80354
Software developer in test SDET DeFi,TruFin Labs,https://web3.career/software-developer-in-test-sdet-defi-trufin-labs/80322
Junior SE2 Frontend Engineer,Seedify,https://web3.career/junior-se2-frontend-engineer-seedify-fund/80316
Staff FullStack Engineer,BitGo,https://web3.career/staff-full-stack-engineer-bitgo/80313
React Native Mobile App Developer,QUANTINIUM,https://web3.career/react-native-mobile-app-developer-quantinium/80286
Software Engineer Credit Card Mobile,Gemini,https://web3.career/software-engineer-credit-card-mobile-gemini/80250
React Web Developer,QUANTINIUM,https://web3.career/react-web-developer-quantinium/80189
Software Developer Credit Card Frontend,Gemini,https://web3.career/software-developer-credit-card-frontend-gemini/80119
Senior Software Engineer Credit Card Mobile,Gemini,https://web3.career/senior-software-engineer-credit-card-mobile-gemini/80118
Senior Frontend Engineer KYC,Binance,https://web3.career/senior-frontend-engineer-kyc-binance/80018
Software Engineering Lead Manager RealTime Inmation Flows Hedge Fund,Hermeneutic Investments,https://web3.career/software-engineering-lead-manager-real-time-information-flows-hedge-fund-hermeneutic-investments/71940
Senior Frontend Engineer Growth,Binance,https://web3.career/senior-frontend-engineer-growth-binance/79884
Staff Software Engineer Blockchain Integration,Ledger,https://web3.career/staff-software-engineer-blockchain-integration-ledger/79785
FrontEnd Developer UI Design System,Toku,https://web3.career/front-end-developer-ui-design-system-toku/79755
Software Engineer React Web,Kraken,https://web3.career/software-engineer-react-web-kraken/79630
Senior Software Engineer Frontend,Aurora Labs,https://web3.career/senior-software-engineer-frontend-aurora-dev/79622
Senior Full Stack Web3 Engineer Open Campus,Animoca Brands Limited,https://web3.career/senior-full-stack-web3-engineer-open-campus-animocabrands/79592
Software Engineer New Grad,Magna,https://web3.career/software-engineer-new-grad-magna/67428
Senior Full Stack Engineer Growth Team,Ether.Fi,https://web3.career/senior-full-stack-engineer-growth-team-ether-fi/79518
Web Developer,IFT,https://web3.career/web-developer-iftother/79515
Full Stack Engineer Regulated Services,Fireblocks,https://web3.career/full-stack-engineer-regulated-services-fireblocks/79483
Senior Software Engineer,Tensor,https://web3.career/senior-software-engineer-tensor/65518
Tech Lead Crypto AI Vietnam Remote Astra,Token Metrics,https://web3.career/tech-lead-crypto-ai-vietnam-remote-astra-tokenmetrics/79463
Tech Lead Crypto AI South Africa Remote Astra,Token Metrics,https://web3.career/tech-lead-crypto-ai-south-africa-remote-astra-tokenmetrics/79462
Tech Lead Crypto AI Portugal Remote Astra,Token Metrics,https://web3.career/tech-lead-crypto-ai-portugal-remote-astra-tokenmetrics/79461
Tech Lead Crypto AI Philippines Remote Astra,Token Metrics,https://web3.career/tech-lead-crypto-ai-philippines-remote-astra-tokenmetrics/79460
Tech Lead Crypto AI Pakistan Remote Astra,Token Metrics,https://web3.career/tech-lead-crypto-ai-pakistan-remote-astra-tokenmetrics/79459
Tech Lead Crypto AI Malaysia Remote Astra,Token Metrics,https://web3.career/tech-lead-crypto-ai-malaysia-remote-astra-tokenmetrics/79458
Tech Lead Crypto AI Indonesia Remote Astra,Token Metrics,https://web3.career/tech-lead-crypto-ai-indonesia-remote-astra-tokenmetrics/79457
Tech Lead Crypto AI India Remote Astra,Token Metrics,https://web3.career/tech-lead-crypto-ai-india-remote-astra-tokenmetrics/79456
Tech Lead Crypto AI Colombia Remote Astra,Token Metrics,https://web3.career/tech-lead-crypto-ai-colombia-remote-astra-tokenmetrics/79455
Graduate Software Engineer,Swyftx,https://web3.career/graduate-software-engineer-swyftx/79391
Senior FrontEnd Drupal Developer,Launchpadtechnologiesinc,https://web3.career/senior-front-end-drupal-developer-launchpadtechnologiesinc/79291
QA Engineer,Launchpadtechnologiesinc,https://web3.career/qa-engineer-launchpadtechnologiesinc/79290
Full Stack Developer,Coins.ph,https://web3.career/full-stack-developer-coins/79257
Senior Fullstack Engineer Custody Services,BitGo,https://web3.career/senior-fullstack-engineer-custody-services-bitgo/79228
Blockchain Consultant,FCS Software Solutions Ltd,https://web3.career/blockchain-consultant-fcssoftwaresolutionsltd/79165
Senior Front End Engineer,Fuel Labs,https://web3.career/senior-front-end-engineer-fuellabs/79126
Senior Analyst Periodic Review KYC Ops,Circle,https://web3.career/senior-analyst-periodic-review-kyc-ops-circle/79119
Senior Frontend Engineer,Nexus,https://web3.career/senior-frontend-engineer-nexus/79110
Principal KYC Analyst Specialized Diligence,Circle - Referrals,https://web3.career/principal-kyc-analyst-specialized-diligence-circlereferrals/78902
Principal KYC Analyst Specialized Diligence,Circle,https://web3.career/principal-kyc-analyst-specialized-diligence-circle/78901
Senior Fullstack developer,Lemon.io,https://web3.career/senior-full-stack-developer-lemon-io/78893
Senior Software Engineer Acquisition Activation Fullstack,Gemini,https://web3.career/senior-software-engineer-acquisition-activation-fullstack-gemini/78827
Frontend Software Engineer Metamask,Consensys,https://web3.career/frontend-software-engineer-metamask-consensys/78824
Sr Software Engineer Product,Scout AI,https://web3.career/sr-software-engineer-product-teamups/78715
FullStack Developer,Vacuumgroup / Vacuumlabs,https://web3.career/full-stack-developer-vacuumgroup-vacuumlabs/78706
Staff Technical Architect,Seedify,https://web3.career/staff-technical-architect-seedify-fund/78677
Web Engineer SH,Coins.ph,https://web3.career/web-engineer-sh-coins/78676
Frontend Engineer Contractor,Wintermute,https://web3.career/frontend-engineer-contractor-wintermute-trading/78675
Director of Engineering,Kiosk,https://web3.career/director-of-engineering-kiosk/72045
Staff Software Engineer Product Engagement Smart Contracts,Gemini,https://web3.career/staff-software-engineer-product-engagement-smart-contracts-gemini/78239
Senior Frontend Engineer Data Products,Chainalysis,https://web3.career/senior-frontend-engineer-data-products-chainalysis/78194
Lead KYC Analyst Specialized Diligence,Circle - Referrals,https://web3.career/lead-kyc-analyst-specialized-diligence-circlereferrals/78183
Lead KYC Analyst Specialized Diligence,Circle,https://web3.career/lead-kyc-analyst-specialized-diligence-circle/78182
Senior Front End Web Developer LisbonRemote,Token Metrics,https://web3.career/senior-front-end-web-developer-lisbon-remote-tokenmetrics/78129
Crypto Senior Full Stack Developer LisbonRemote,Token Metrics,https://web3.career/crypto-senior-full-stack-developer-lisbon-remote-tokenmetrics/78127
Crypto Senior Full Stack Developer Cape Town Remote,Token Metrics,https://web3.career/crypto-senior-full-stack-developer-cape-town-remote-tokenmetrics/78126
Product Manager Core Protocol,Offchain Labs,https://web3.career/product-manager-core-protocol-offchainlabs/78125
Senior React Native Engineer Custody,Avalabs,https://web3.career/senior-react-native-engineer-custody-avalabs/78105
Principle Lead Engineer Java Growth Tech,Binance,https://web3.career/principle-lead-engineer-java-growth-tech-binance/78034
Senior QA Automation Engineer,Consensys,https://web3.career/senior-qa-automation-engineer-consensys/78010
Lead Analyst Compliance Quality Assurance,Circle,https://web3.career/lead-analyst-compliance-quality-assurance-circle/77957
Software Engineer Mobile,Trilitech,https://web3.career/software-engineer-mobile-trilitech/77892
Staff Software Engineer Frontend,Sound.xyz,https://web3.career/staff-software-engineer-frontend-sound-xyz/77848
Senior Fullstack Engineer,Proof of Play,https://web3.career/senior-fullstack-engineer-proofofplay/77817
Staff Frontend Software Engineer,Mysten Labs,https://web3.career/staff-frontend-software-engineer-mystenlabs/77786
Senior Software Engineer Frontend,Mysten Labs,https://web3.career/senior-software-engineer-frontend-mystenlabs/77784
Senior Software Engineer React Native Mobile,Kraken,https://web3.career/senior-software-engineer-react-native-mobile-kraken/77727
Designer Web,Kraken,https://web3.career/designer-web-kraken/77716
Senior Fullstack Engineer Kallikor,Improbable,https://web3.career/senior-full-stack-engineer-kallikor-improbable/77661
FullStack Engineer Kallikor,Improbable,https://web3.career/full-stack-engineer-kallikor-improbable/77660
FullStack Engineer,Hyperbolic Labs,https://web3.career/full-stack-engineer-hyperboliclabs/77649
Design Engineer Frontend,Chiru Labs,https://web3.career/design-engineer-frontend-chirulabs/77606
Security Engineer Product Security,Chainlink Labs,https://web3.career/security-engineer-product-security-chainlinklabs/77599
Staff Software Engineer Economics Ecosystem,Chainlink Labs,https://web3.career/staff-software-engineer-economics-ecosystem-chainlinklabs/77590
Software Engineer Transaction Tracing,Chainalysis,https://web3.career/software-engineer-transaction-tracing-chainalysis/77562
Software Engineer II Investigations,Chainalysis,https://web3.career/software-engineer-ii-investigations-chainalysis/77561
Senior Software Engineer Investigations,Chainalysis,https://web3.career/senior-software-engineer-investigations-chainalysis/77560
Senior Infrastructure Engineer Security,Caldera,https://web3.career/senior-infrastructure-engineer-security-caldera/77530
Senior Fullstack Engineer,Bonfire,https://web3.career/senior-fullstack-engineer-bonfire/77526
Senior Frontend Engineer,Bonfire,https://web3.career/senior-frontend-engineer-bonfire/77525
Next.js React Developer,Ava Protocol,https://web3.career/next-js-react-developer-avaprotocol/77500
Senior Frontend Engineer,Argus Labs,https://web3.career/senior-frontend-engineer-arguslabs/77497
Product Engineer,Anagram,https://web3.career/product-engineer-anagram/77474
Software Engineer Frontend Trust and Loyalty,Coinbase,https://web3.career/software-engineer-frontend-trust-and-loyalty-coinbase/77456
Full Stack Engineer,Wyndlabs,https://web3.career/full-stack-engineer-wyndlabs/77411
Head of Engineering,Commonwealth,https://web3.career/head-of-engineering-commonwealth/77379
Senior Software Engineer Fullstack Institutional Markets Verified Pools,Coinbase,https://web3.career/senior-software-engineer-fullstack-institutional-markets-verified-pools-coinbase/77123
Principal Platm Engineer SRE,Gemini,https://web3.career/principal-platform-engineer-sre-gemini/77120
Senior FrontEnd Engineer,Exodus54,https://web3.career/senior-front-end-engineer-exodus54/77088
Software Engineer Frontend,Gemini,https://web3.career/software-engineer-frontend-gemini/76988
Senior Backend Software Engineer Solana Mobile,Solana Labs,https://web3.career/senior-backend-software-engineer-solana-mobile-solanalabs/77010
Staff Platm Engineer SRE,Gemini,https://web3.career/staff-platform-engineer-sre-gemini/76986
Manager Site Reliability Engineering,Gemini,https://web3.career/manager-site-reliability-engineering-gemini/76985
Founding Full Stack Engineer,Genius,https://web3.career/founding-full-stack-engineer-genius/72724
Crypto SaaS Product Manager Intern South AfricaRemote,Token Metrics,https://web3.career/crypto-saas-product-manager-intern-south-africa-remote-tokenmetrics/76967
Crypto SaaS Product Manager Intern NigeriaRemote,Token Metrics,https://web3.career/crypto-saas-product-manager-intern-nigeria-remote-tokenmetrics/76966
Crypto SaaS Product Manager Intern MumbaiRemote,Token Metrics,https://web3.career/crypto-saas-product-manager-intern-mumbai-remote-tokenmetrics/76965
Crypto SaaS Product Manager Intern LondonRemote,Token Metrics,https://web3.career/crypto-saas-product-manager-intern-london-remote-tokenmetrics/76964
Crypto SaaS Product Manager Intern IndonesiaRemote,Token Metrics,https://web3.career/crypto-saas-product-manager-intern-indonesia-remote-tokenmetrics/76963
Crypto SaaS Product Manager Intern GreeceRemote,Token Metrics,https://web3.career/crypto-saas-product-manager-intern-greece-remote-tokenmetrics/76962
Crypto SaaS Product Manager Intern ColombiaRemote,Token Metrics,https://web3.career/crypto-saas-product-manager-intern-colombia-remote-tokenmetrics/76961
Ton Dapp Developer,TON Solutions,https://web3.career/ton-dapp-developer-ton-solutions/72556
Senior Fullstack Engineer,Absinthe Labs,https://web3.career/senior-fullstack-engineer-absinthe-labs/74472
Web Developer,Paypal,https://web3.career/web-developer-paypal/76914
Senior Backend Software Engineer Solana Mobile,Solanafoundation,https://web3.career/senior-backend-software-engineer-solana-mobile-solanafoundation/76903
Senior Backend Software Engineer Solana Mobile,Solana,https://web3.career/senior-backend-software-engineer-solana-mobile-solana/76902
Senior Drupal Frontend Developer,Launchpadtechnologiesinc,https://web3.career/senior-drupal-frontend-developer-launchpadtechnologiesinc/76820
Senior Product Engineer,Polymarket,https://web3.career/senior-product-engineer-polymarket/70227
Frontend Engineer,Bridgesplit,https://web3.career/frontend-engineer-bridgesplit/76757
Staff Engineer Backend,Gemini,https://web3.career/staff-engineer-backend-gemini/76737
Expert Smart Contracts Engineer,Iovlabsltd,https://web3.career/expert-smart-contracts-engineer-iovlabsltd/73677
Senior Front End Engineer,Blackwing.fi,https://web3.career/senior-front-end-engineer-blackwing-fi/63699
Senior Javascript Backend Developer,Applied Blockchain,https://web3.career/senior-javascript-backend-developer-appliedblockchain/76623
Senior Full Stack Developer Microsoft Stack,Launchpadtechnologiesinc,https://web3.career/senior-full-stack-developer-microsoft-stack-launchpadtechnologiesinc/76585
Senior Full Stack Engineer Wallet Experience,BitGo,https://web3.career/senior-full-stack-engineer-wallet-experience-bitgo/76397
Senior Full Stack Engineer Wallet Experience,BitGo,https://web3.career/senior-full-stack-engineer-wallet-experience-bitgo/76396
Senior Full Stack Engineer Wallet Experience,BitGo,https://web3.career/senior-full-stack-engineer-wallet-experience-bitgo/76395
Front End UI Developer,Launchpadtechnologiesinc,https://web3.career/front-end-ui-developer-launchpadtechnologiesinc/76390
Security Specialists Auditors,Drag,https://web3.career/security-specialists-auditors-drag/76195
Senior FrontEnd Engineer,Serotonin,https://web3.career/senior-front-end-engineer-serotonin/76115
Frontend Engineer KYC,Binance,https://web3.career/frontend-engineer-kyc-binance/76113
Senior Front End Engineer Core Consumer,Avalabs,https://web3.career/senior-front-end-engineer-core-consumer-avalabs/76023
UI Software Developer,B2C2,https://web3.career/ui-software-developer-b2c2/75999
Senior Full Stack Developer,Launchpadtechnologiesinc,https://web3.career/senior-full-stack-developer-launchpadtechnologiesinc/75938
Senior Frontend Engineer Americas,Superform,https://web3.career/senior-frontend-engineer-americas-superform/75861
Blockchain Developer,Pyramid Consulting, Inc,https://web3.career/blockchain-developer-pyramidconsulting-inc/75797
